ListSchema={"schemaXmlList":["<Field ID=\"{fa564e0f-0c70-4ab9-b863-0177e6ddd247}\" Type=\"Text\" Name=\"Title\" DisplayName=\"Title\" Required=\"FALSE\" SourceID=\"http://schemas.microsoft.com/sharepoint/v3\" StaticName=\"Title\" FromBaseType=\"TRUE\" MaxLength=\"255\" />","<Field Type=\"Text\" DisplayName=\"MatchText\" Name=\"field_1\" ID=\"{97dc815b-b0a5-40b8-b219-921bbc1f6274}\" StaticName=\"field_1\" />","<Field Type=\"Text\" DisplayName=\"NormalizedCategory\" Name=\"field_2\" ID=\"{92e0dc7c-9995-47e7-af58-5da5d1a4a0df}\" StaticName=\"field_2\" />","<Field ClientSideComponentId=\"00000000-0000-0000-0000-000000000000\" DisplayName=\"BayCategory\" FillInChoice=\"TRUE\" Format=\"Dropdown\" Name=\"field_3\" Title=\"BayCategory\" Type=\"Choice\" ID=\"{647f3346-71dd-4ebe-9ccb-8f32e329016b}\" StaticName=\"field_3\"><CHOICES><CHOICE>Tempered</CHOICE><CHOICE>MirrorAnnealed</CHOICE><CHOICE>ManualException</CHOICE></CHOICES></Field>","<Field Type=\"Number\" DisplayName=\"Priority\" Name=\"field_4\" ID=\"{1c2a8491-2a99-49a2-8c3f-f215b6860892}\" StaticName=\"field_4\" />","<Field ClientSideComponentId=\"00000000-0000-0000-0000-000000000000\" DisplayName=\"Active\" Format=\"Dropdown\" Name=\"field_5\" Title=\"Active\" Type=\"Boolean\" ID=\"{43f379b9-134e-49bd-8bcd-d47cc9a258b7}\" StaticName=\"field_5\"><Default>1</Default></Field>","<Field ID=\"{2c2fe11a-8a0a-4654-94eb-0ceb33c88974}\" DisplayName=\"Notes\" Name=\"field_6\" StaticName=\"field_6\" Type=\"Note\" />","<Field ID=\"{82642ec8-ef9b-478f-acf9-31f7d45fbc31}\" ReadOnly=\"TRUE\" Type=\"Computed\" Name=\"LinkTitle\" DisplayName=\"RuleName\" DisplayNameSrcField=\"Title\" ClassInfo=\"Menu\" AuthoringInfo=\"(linked to item with edit menu)\" ListItemMenuAllowed=\"Required\" LinkToItemAllowed=\"Prohibited\" SourceID=\"http://schemas.microsoft.com/sharepoint/v3\" StaticName=\"LinkTitle\" FromBaseType=\"TRUE\"><FieldRefs><FieldRef Name=\"Title\" /><FieldRef Name=\"LinkTitleNoMenu\" /><FieldRef Name=\"_EditMenuTableStart2\" /><FieldRef Name=\"_EditMenuTableEnd\" /></FieldRefs><DisplayPattern><FieldSwitch><Expr><GetVar Name=\"FreeForm\" /></Expr><Case Value=\"TRUE\"><Field Name=\"LinkTitleNoMenu\" /></Case><Default><HTML><![CDATA[<div class=\"ms-vb itx\" onmouseover=\"OnItem(this)\" CTXName=\"ctx]]></HTML><Field Name=\"_EditMenuTableStart2\" /><HTML><![CDATA[\">]]></HTML><Field Name=\"LinkTitleNoMenu\" /><HTML><![CDATA[</div>]]></HTML><HTML><![CDATA[<div class=\"s4-ctx\" onmouseover=\"OnChildItem(this.parentNode); return false;\">]]></HTML><HTML><![CDATA[<span>&nbsp;</span>]]></HTML><HTML><![CDATA[<a onfocus=\"OnChildItem(this.parentNode.parentNode); return false;\" onclick=\"PopMenuFromChevron(event); return false;\" href=\"javascript:;\" title=\"Open Menu\"></a>]]></HTML><HTML><![CDATA[<span>&nbsp;</span>]]></HTML><HTML><![CDATA[</div>]]></HTML></Default></FieldSwitch></DisplayPattern></Field>"]}
"RuleName","MatchText","NormalizedCategory","BayCategory","Priority","Active","Notes"
"Header BFS Mirror","BFS MIRROR","MirrorAnnealed","MirrorAnnealed","1","True","Specific mirror rule. Checked before generic MIRROR."
"Header Mirror","MIRROR","MirrorAnnealed","MirrorAnnealed","2","True","Mirror headers route to Mirror/BFS mirror bays."
"Header Annealed","ANNEALED","MirrorAnnealed","MirrorAnnealed","3","True","Annealed headers route to Mirror/BFS mirror bays."
"Header Tempered","TEMPERED","Tempered","Tempered","10","True","Tempered headers route to blue bays 12-16."
"Header Coral","CORAL","CoralIgnored","ManualException","50","True","Coral is not auto-assigned in v1."
"Unknown Header Fallback","UNKNOWN","ManualException","ManualException","99","True","Use when no recognized header/category is found."
